{
  "name": "Tropical 5 MW reference facility",
  "schema_version": 1,
  "it_kw": 5000,
  "halls": 4,
  "racks_per_hall": 50,
  "rack_kw": 25,
  "design_ambient_c": 35,
  "ups_efficiency": 0.965,
  "distribution_efficiency": 0.99,
  "transformer_efficiency": 0.99,
  "power_factor": 0.95,
  "design_margin": 0.1,
  "ups_module_kw": 1250,
  "transformer_unit_kva": 4000,
  "generator_unit_kw": 3000,
  "generator_derating": 0.9,
  "battery_minutes": 10,
  "battery_inverter_efficiency": 0.96,
  "battery_usable_fraction": 0.8,
  "battery_end_of_life_fraction": 0.8,
  "liquid_fraction": 0.3,
  "cop_at_30c": 4.5,
  "cop_degradation_per_c": 0.07,
  "minimum_cop": 2.5,
  "chiller_unit_kwth": 1250,
  "cdu_unit_kwth": 500,
  "fan_fraction": 0.02,
  "pump_fraction": 0.012,
  "envelope_kw": 80,
  "other_facility_kw": 80,
  "water_delta_t_k": 6,
  "air_delta_t_k": 12,
  "mean_draw_fraction": 0.75,
  "draw_amplitude": 0.1,
  "weather_mean_c": 29,
  "weather_daily_amplitude_c": 4,
  "weather_seasonal_amplitude_c": 2,
  "electricity_usd_per_kwh": 0.1,
  "demand_usd_per_kw_month": 5,
  "grid_kgco2e_per_kwh": 0.7,
  "site_water_l_per_it_kwh": 0.05,
  "pv_kwp": 0,
  "pv_performance_ratio": 0.8,
  "bess_supported_kw": 1000,
  "bess_hours": 2,
  "bess_discharge_efficiency": 0.92,
  "bess_usable_fraction": 0.8,
  "bess_end_of_life_fraction": 0.8,
  "base_capex_usd": 48000000,
  "contingency_fraction": 0.2,
  "fixed_opex_usd_year": 1200000,
  "maintenance_fraction": 0.015,
  "capacity_usd_kw_month": 180,
  "energy_recovery_fraction": 1,
  "discount_rate": 0.1,
  "escalation": 0.02,
  "replacement_year": 8,
  "replacement_usd": 3000000,
  "residual_fraction": 0.15,
  "occupancy": [0.35, 0.5, 0.65, 0.8, 0.9, 0.95, 0.95, 0.95, 0.95, 0.95, 0.95, 0.95, 0.95, 0.95, 0.95],
  "path_unavailability": 0.02,
  "common_cause_unavailability": 0.001,
  "reliability_samples": 100000,
  "seed": 42
}
